{"$schema":"./challenger-replacement-owner-attestation-v1.schema.json","attestation_hash":"6572c417f9c8959e42d9a689625ed69e2568a4ebcd9f369dc59e384cbb38c32d","attestation_id":"challenger_replacement_owner_attestation_da8fba9c6d090cb2ed95ea02a4cabd7c6696b54b331d8b104b8b6c0bc1796a05","attestation_type":"ACCOUNTABLE_OWNER_PRE_START_HISTORY_ATTESTATION_V1","ceremony_precondition":{"allowlisted_finals":[{"ctime_ns_decimal":"1787277144910492554","device_decimal":"16777229","file_sha256":"dd5e7970f4cfbfab71e9dec2894ce6ff96895dd20757dd8165acda9922939968","inode_decimal":"21466231","mode_octal":"0644","mtime_ns_decimal":"1787277144910248677","nlink":1,"path":"artifacts/challenger-replacement/challenger-replacement-supersession-machine-evidence-v0.64.0.json","size":18113}],"candidate_head":"3a6cf9cbeaec73038116dddc2bbb264096125db7","head_transcript":{"argv":["/usr/bin/git","-C","/Users/chenm4/Documents/虚拟货币/.worktrees/v0.64-public-ci-r3-design","rev-parse","HEAD"],"exit_code":0,"name":"candidate_head","stderr_base64":"","stderr_sha256":"e3b0c44298fc1c149afbf4c8996fb92427ae41e4649b934ca495991b7852b855","stdout_base64":"M2E2Y2Y5Y2JlYWVjNzMwMzgxMTZkZGRjMmJiYjI2NDA5NjEyNWRiNwo=","stdout_sha256":"f1d9cbc1e3c5d29372db61a2fbfaab707aa1cfe9531fe1bb547536a9c2bfbb87"},"staging_inventory":[],"state":"C1_EVIDENCE_ONLY","status_transcript":{"argv":["/usr/bin/git","-C","/Users/chenm4/Documents/虚拟货币/.worktrees/v0.64-public-ci-r3-design","status","--porcelain=v1","--untracked-files=all"],"exit_code":0,"name":"candidate_status","stderr_base64":"","stderr_sha256":"e3b0c44298fc1c149afbf4c8996fb92427ae41e4649b934ca495991b7852b855","stdout_base64":"Pz8gYXJ0aWZhY3RzL2NoYWxsZW5nZXItcmVwbGFjZW1lbnQvY2hhbGxlbmdlci1yZXBsYWNlbWVudC1zdXBlcnNlc3Npb24tbWFjaGluZS1ldmlkZW5jZS12MC42NC4wLmpzb24K","stdout_sha256":"d5227d3e17702168bd281e2d9dfa9f25f7fcc10c44d19c38e27122476d11038d"}},"declaration":"I attest that, before the signed_at timestamp in this object and before the linked machine observation, the replacement Challenger service_identity and runtime_root bound by previous_plan and superseding_plan in this object had never been installed or started and had produced no start receipt, canonical event, real slot, or production state write. I accept accountability for this historical declaration and understand that it is not proved by the collector, loader, Git history, or operating-system snapshot.","evidence_qualification":"REAL_MACHINE_READ_ONLY_SUPERSESSION_PRECONDITION","machine_evidence_binding":{"evidence_hash":"7d1be628c1e75172dbb536351be1c8e7940d74bd0a828e6390fdae33b8a5f264","evidence_id":"challenger_replacement_supersession_machine_evidence_79ba192b18f7427d0ed78ff04a56c2b0812f66f87ef28fb65dd15ca7bdfd8ca7","file_sha256":"dd5e7970f4cfbfab71e9dec2894ce6ff96895dd20757dd8165acda9922939968","git_history_evidence_hash":"bc0612f2100b97cc209004883487303320fa34f2f8db69ecc80ae979e6ff167e","path":"artifacts/challenger-replacement/challenger-replacement-supersession-machine-evidence-v0.64.0.json"},"owner_acknowledgement":"I_SIGN_AND_ACCEPT_ACCOUNTABILITY_FOR_THE_EXACT_DECLARATION","previous_plan":{"file_sha256":"d450d1e9f8dc422eb5a93beb8a5ffbb1746a4a6d1facb3c5a20a76f4bd527734","path":"artifacts/challenger-replacement/challenger-replacement-plan-v0.62.0.json","peeled_commit":"e0a9b3eb6a3f385ea259722e6613df8708e8fe5a","plan_hash":"95f395b17d9c09d325c58391542ce5f3d9df5ce6a706b1bba8ffcb62dc6c883c","plan_id":"challenger_replacement_plan_d4a542c1566f7a90466ca4d5301b81847f5b5eba93c7a00903d2d95331bc23a2","release_tag":"v0.62.0","runtime_root":"/Users/chenm4/Library/Application Support/CryptoQuant/challenger-replacement-v1","service_identity":"gui/501/local.crypto-quant.challenger-replacement-v1"},"schema_version":"1.0.0","signed_at":"2026-08-21T07:52:38.055Z","signer_github_login":"cjl308868584-lang","signer_os_username":"chenm4","signer_uid":501,"superseding_plan":{"file_sha256":"5f1774fd912451d79c9efe13401e80f312fee3c707d9faa252933ef3e8810a8f","foundation":{"build_input_tree_hash":"7fdfd6c69f1342892b222882b76ee4988487a482c958a9cdacf00461b2fd8f19","manifest_file_sha256":"13bea4bfcf633e767eed73d431e57d496dcee47820aacf92e7b61b0efed5c546","manifest_hash":"f4a74896a6d7b2166adba86075ef06b8d7986f900a086d04ee2f03754baded4b","manifest_version":"1.57.0","package_version":"0.63.0","peeled_commit":"df91e19240df14839125608422489adf3b902e76","release_tag":"v0.63.0"},"path":"artifacts/challenger-replacement/challenger-replacement-plan-v0.64.0.json","plan_hash":"c9a1e5f74c52fbf23be5a1d27fd23c25f3601ed58133178fc25480391ab65705","plan_id":"challenger_replacement_plan_65d85d60a534a917f45a1ffa5fc9d3f74d6d24995b900d31b8c73cd26f0bd97b","runtime_root":"/Users/chenm4/Library/Application Support/CryptoQuant/challenger-replacement-v1","service_identity":"gui/501/local.crypto-quant.challenger-replacement-v1"}}
